{
	"title": "Decentralized Storage: The Future of Data Privacy",
	"slug": "decentralized-storage-future-data-privacy",
	"heroImage": {
		"mediaType": "image/jpeg",
		"url": "https://example.com/images/hero-decentralized-storage.jpg"
	},
	"content": "# Decentralized Storage: The Future of Data Privacy\n\nIn an era where data breaches and privacy concerns dominate headlines, **decentralized storage** emerges as a revolutionary solution that puts control back into the hands of users.\n\n## Why Decentralized Storage Matters\n\nTraditional cloud storage solutions rely on centralized servers controlled by large corporations. This creates several vulnerabilities:\n\n- **Single points of failure**: If the central server goes down, your data becomes inaccessible\n- **Privacy concerns**: Your data is stored on servers you don't control\n- **Censorship risks**: Centralized authorities can restrict access to your content\n\n## The Filecoin Advantage\n\nFilecoin revolutionizes storage by:\n\n1. **Distributing data** across a global network of storage providers\n2. **Encrypting files** before they leave your device\n3. **Incentivizing reliability** through blockchain-based rewards\n4. **Ensuring redundancy** with multiple copies across different nodes\n\n## Getting Started\n\nImplementing decentralized storage in your applications is easier than ever with modern tools and APIs. Start by exploring the Filecoin ecosystem and integrating secure, private storage solutions today.\n\n---\n\n*The future of data storage is decentralized, secure, and in your control.*",
	"metaDescription": "Explore how decentralized storage on Filecoin provides better privacy, security, and control over your data compared to traditional cloud solutions.",
	"author": "Alex Chen",
	"publishDate": "2025-06-15",
	"tags": ["decentralized-storage", "filecoin", "privacy", "blockchain", "web3", "data-security"]
}
